{
  "$schema": "https://json-schema.org/draft/2020-12/schema",
  "title": "A013 report schema",
  "type": "object",
  "additionalProperties": false,
  "required": ["checkId", "checkTitle", "timestamptz", "nodes", "results"],
  "properties": {
    "version": { "type": ["string", "null"] },
    "build_ts": { "type": ["string", "null"] },
    "checkId": { "const": "A013" },
    "checkTitle": { "const": "Postgres minor version" },
    "timestamptz": { "type": "string" },
    "nodes": { "$ref": "#/$defs/nodes" },
    "results": {
      "type": "object",
      "minProperties": 1,
      "additionalProperties": { "$ref": "#/$defs/nodeResult" }
    }
  },
  "$defs": {
    "nodes": {
      "type": "object",
      "additionalProperties": false,
      "required": ["primary", "standbys"],
      "properties": {
        "primary": { "type": "string" },
        "standbys": { "type": "array", "items": { "type": "string" } }
      }
    },
    "postgresVersion": {
      "type": "object",
      "additionalProperties": false,
      "required": ["version", "server_version_num", "server_major_ver", "server_minor_ver"],
      "properties": {
        "version": { "type": "string" },
        "server_version_num": { "type": "string" },
        "server_major_ver": { "type": "string" },
        "server_minor_ver": { "type": "string" }
      }
    },
    "data": {
      "type": "object",
      "additionalProperties": false,
      "required": ["version"],
      "properties": {
        "version": { "$ref": "#/$defs/postgresVersion" }
      }
    },
    "nodeResult": {
      "type": "object",
      "additionalProperties": false,
      "required": ["data"],
      "properties": {
        "data": { "$ref": "#/$defs/data" }
      }
    }
  }
}
