{
  "version": "0.0.0-dev.0",
  "build_ts": "2025-12-25T10:09:54.142Z",
  "checkId": "A013",
  "checkTitle": "Postgres minor version",
  "timestamptz": "2025-12-25T10:11:14.520Z",
  "nodes": {
    "primary": "node-01",
    "standbys": []
  },
  "results": {
    "node-01": {
      "data": {
        "version": {
          "version": "17.6 (Ubuntu 17.6-2.pgdg22.04+1)",
          "server_version_num": "170006",
          "server_major_ver": "17",
          "server_minor_ver": "6"
        }
      }
    }
  }
}